{"findings":[{"case_id":"0f42244e-44ba-5c7b-a9eb-ed2eaf6288f1","checkpoint_state_correct":true,"classification_correct":true,"clearing_tick_correct":true,"detection_correct":true,"evidence_continuity_correct":true,"opening_tick_correct":true,"recurrence_correct":true,"remediation_correct":true,"synthetic":true},{"case_id":"424e169d-1940-5f00-b654-f27a6859057e","checkpoint_state_correct":true,"classification_correct":true,"clearing_tick_correct":true,"detection_correct":true,"evidence_continuity_correct":true,"opening_tick_correct":true,"recurrence_correct":true,"remediation_correct":true,"synthetic":true},{"case_id":"443a730d-8362-5deb-927f-7267e07baf48","checkpoint_state_correct":true,"classification_correct":true,"clearing_tick_correct":true,"detection_correct":true,"evidence_continuity_correct":true,"opening_tick_correct":true,"recurrence_correct":true,"remediation_correct":true,"synthetic":true},{"case_id":"4dc07d73-253b-5e73-b259-b33aa1175e08","checkpoint_state_correct":true,"classification_correct":true,"clearing_tick_correct":true,"detection_correct":true,"evidence_continuity_correct":true,"opening_tick_correct":true,"recurrence_correct":true,"remediation_correct":true,"synthetic":true},{"case_id":"6527f764-d79c-5e16-8deb-fa496bad115a","checkpoint_state_correct":true,"classification_correct":true,"clearing_tick_correct":true,"detection_correct":true,"evidence_continuity_correct":true,"opening_tick_correct":true,"recurrence_correct":true,"remediation_correct":true,"synthetic":true},{"case_id":"766aecaf-ef33-5118-ba97-e8e613e531c1","checkpoint_state_correct":true,"classification_correct":true,"clearing_tick_correct":true,"detection_correct":true,"evidence_continuity_correct":true,"opening_tick_correct":true,"recurrence_correct":true,"remediation_correct":true,"synthetic":true},{"case_id":"94225c63-f03c-5202-a920-9b55841aaa46","checkpoint_state_correct":true,"classification_correct":true,"clearing_tick_correct":true,"detection_correct":true,"evidence_continuity_correct":true,"opening_tick_correct":true,"recurrence_correct":true,"remediation_correct":true,"synthetic":true},{"case_id":"f22d0eb4-7fb0-5598-a5bf-4d112eaf6f07","checkpoint_state_correct":true,"classification_correct":true,"clearing_tick_correct":true,"detection_correct":true,"evidence_continuity_correct":true,"opening_tick_correct":true,"recurrence_correct":true,"remediation_correct":true,"synthetic":true}],"metrics":[{"aggregation":"ratio","denominator":7,"denominator_meaning":"truth cases requiring drift classification","empty_behavior":"null_if_empty","family":"classification","name":"drift_classification_accuracy","numerator":7,"support":7,"synthetic":true,"value":1.0},{"aggregation":"ratio","denominator":424,"denominator_meaning":"case and declared-checkpoint finding-state cells","empty_behavior":"null_if_empty","family":"detection","name":"checkpoint_finding_state_accuracy","numerator":424,"support":424,"synthetic":true,"value":1.0},{"aggregation":"mean_ticks","denominator":7,"denominator_meaning":"validly detected truth findings","empty_behavior":"null_if_empty","family":"detection","name":"detection_latency_mean_ticks","numerator":0,"support":7,"synthetic":true,"value":0.0},{"aggregation":"ratio","denominator":7,"denominator_meaning":"truth cases requiring a finding","empty_behavior":"null_if_empty","family":"detection","name":"false_negative_rate","numerator":0,"support":7,"synthetic":true,"value":0.0},{"aggregation":"ratio","denominator":1,"denominator_meaning":"truth cases requiring no finding","empty_behavior":"null_if_empty","family":"detection","name":"false_positive_rate","numerator":0,"support":1,"synthetic":true,"value":0.0},{"aggregation":"ratio","denominator":7,"denominator_meaning":"truth cases requiring a finding","empty_behavior":"null_if_empty","family":"detection","name":"finding_detection_recall","numerator":7,"support":7,"synthetic":true,"value":1.0},{"aggregation":"ratio","denominator":7,"denominator_meaning":"truth cases with an expected finding-open tick","empty_behavior":"null_if_empty","family":"detection","name":"finding_open_tick_accuracy","numerator":7,"support":7,"synthetic":true,"value":1.0},{"aggregation":"ratio","denominator":7,"denominator_meaning":"submitted finding openings","empty_behavior":"null_if_empty","family":"detection","name":"finding_precision","numerator":7,"support":7,"synthetic":true,"value":1.0},{"aggregation":"ratio","denominator":7,"denominator_meaning":"truth cases requiring a finding","empty_behavior":"null_if_empty","family":"detection","name":"pre_observation_opening_rate","numerator":0,"support":7,"synthetic":true,"value":0.0},{"aggregation":"ratio","denominator":7,"denominator_meaning":"truth findings with evidence-continuity truth","empty_behavior":"null_if_empty","family":"evidence","name":"evidence_continuity_accuracy","numerator":7,"support":7,"synthetic":true,"value":1.0},{"aggregation":"ratio","denominator":1,"denominator_meaning":"submitted recurrence openings","empty_behavior":"null_if_empty","family":"recurrence","name":"recurrence_precision","numerator":1,"support":1,"synthetic":true,"value":1.0},{"aggregation":"ratio","denominator":1,"denominator_meaning":"expected recurrence openings","empty_behavior":"null_if_empty","family":"recurrence","name":"recurrence_recall","numerator":1,"support":1,"synthetic":true,"value":1.0},{"aggregation":"ratio","denominator":5,"denominator_meaning":"truth cases with remediation-completeness truth","empty_behavior":"null_if_empty","family":"remediation","name":"remediation_completeness_accuracy","numerator":5,"support":5,"synthetic":true,"value":1.0},{"aggregation":"ratio","denominator":6,"denominator_meaning":"expected finding-clear transitions","empty_behavior":"null_if_empty","family":"staleness","name":"finding_clear_tick_accuracy","numerator":6,"support":6,"synthetic":true,"value":1.0},{"aggregation":"ratio","denominator":6,"denominator_meaning":"expected finding-clear transitions","empty_behavior":"null_if_empty","family":"staleness","name":"premature_clear_rate","numerator":0,"support":6,"synthetic":true,"value":0.0},{"aggregation":"mean_ticks","denominator":6,"denominator_meaning":"expected finding-clear transitions","empty_behavior":"null_if_empty","family":"staleness","name":"stale_finding_duration_mean_ticks","numerator":0,"support":6,"synthetic":true,"value":0.0}],"schema_version":"1.0.0","scoring_version":"1.0.0","synthetic":true}
